{
    "$schema": "http://json-schema.org/draft-06/schema#",
    "title": "Crashes",
    "description": "Defines the structure of a set of crashes",
    "type": "array",
    "items": {
        "title": "Crash",
        "description": "Defines the structure of a crash",
        "type": "object",
        "properties": {
            "id": {
                "description": "Unique identifier of crash",
                "type": ["string", "number"]
            },
            "dateOccurred": {
                "description": "Date crash occurred, ISO8601 formatted",
                "type": "string",
                "format": "date-time"
            },
            "location": {
                "description": "Coordinates of crash, WGS84 formatted",
                "type": "object",
                "properties": {
                    "latitude": {
                        "description": "Latitude of crash",
                        "type": "number"
                    },
                    "longitude": {
                        "description": "Longitude of crash",
                        "type": "number"
                    }
                }
            },
            "vehicles": {
                "description": "Vehicles involved in crash",
                "type": "array",
                "items": {
                    "title": "Vehicle",
                    "description": "Defines the structure of a vehicle",
                    "type": "object",
                    "properties": {
                        "category": {
                            "description": "Category of vehicle",
                            "type": "string",
                            "enum": ["car", "bike", "taxi", "bus", "truck"]
                        },
                        "quantity": {
                            "description": "Quantity of vehicles of this category",
                            "type": "number"
                        }
                    },
                    "required": ["category"]
                },
                "uniqueItems": true
            },
            "persons": {
                "description": "Persons involved in crash",
                "type": "array",
                "items": {
                    "title": "Person",
                    "description": "Defines the structure of a person",
                    "type": "object",
                    "properties": {
                        "category": {
                            "description": "Category of person",
                            "type": "string",
                            "enum": ["driver", "pedestrian", "cyclist", "other"]
                        },
                        "quantity": {
                            "description": "Quantity of persons",
                            "type": "number"
                        },
                        "injuryType": {
                            "description": "Type of injury",
                            "type": "string",
                            "enum": ["minor", "major", "fatal", "unknown"]
                        }
                    },
                    "required": ["category"]
                },
                "uniqueItems": true
            },
            "address": {
                "description": "Address of crash",
                "type": "string"
            },
            "summary": {
                "description": "Summary of crash",
                "type": "string"
            }
        },
        "required": ["id", "dateOccurred", "location"]
    }
}
